<?xml version="1.0" encoding="UTF-8"?>
<tns:tracking-config xmlns:tns="http://e-adventure.e-ucm.es/eadventure-tracking-schema" xmlns:xsi="http://www.w3.org/2001/XMLSchema-instance" xsi:schemaLocation="http://e-adventure.e-ucm.es/eadventure-tracking-schema eadventure-tracking-schema.xsd ">
	
	<tns:enabled>true</tns:enabled>
	<tns:main-class>es.eucm.eadventure.tracking.prv.TrackingController</tns:main-class>
	
	<tns:property>
	    <tns:name>game-id</tns:name>
	    <tns:value>damaboba_v5b</tns:value>
	</tns:property>
	
	<tns:property>
	    <tns:name>student-id</tns:name>
	    <tns:value>ask</tns:value>
	</tns:property>
	
	<tns:property>
	    <tns:name>log-effects</tns:name>
	    <tns:value>true</tns:value>
	</tns:property>
	
	<tns:property>
	    <tns:name>low-level-freq</tns:name>
	    <tns:value>500</tns:value>
	</tns:property>
	
	<tns:service>
	    <tns:enabled>true</tns:enabled>
	    <tns:name>local-log</tns:name>
	    <tns:class>es.eucm.eadventure.tracking.prv.service.GameLogConsumerLocal</tns:class>
	    <tns:frequency>10000</tns:frequency>
	</tns:service>
	
	<tns:service>
	    <tns:enabled>true</tns:enabled>
	    <tns:name>remote-log</tns:name>
	    <tns:class>es.eucm.eadventure.tracking.prv.service.GameLogConsumerHTTP</tns:class>
	    <tns:frequency>5000</tns:frequency>
	    <tns:url>backend-ea.e-ucm.es/api/sessions/</tns:url>
	    <tns:path>chunks</tns:path>
	</tns:service>
	
</tns:tracking-config>
